{
  "schema_version": "incidentseal-topology-render/v1",
  "contract_digest": "sha256:a6443d83ae9eb463780a74f76e34db496a7731f0470fa6976a7678cc1a4eae82",
  "project_name": "incidentseal-0123456789abcdef",
  "operation_mode": "platform-validation",
  "services": [
    {
      "id": "database",
      "image": "sha256:64c33dd94e09026bb01639329e46f2944dc1f794b04d3d2191f268ba7352fab9",
      "user": "70:70",
      "read_only_root": true,
      "privileged": false,
      "no_new_privileges": true,
      "cap_drop": ["ALL"],
      "networks": ["data"],
      "published_ports": [],
      "mounts": [
        {"kind": "named-volume", "target": "/var/lib/postgresql/data", "mode": "rw"},
        {"kind": "tmpfs", "target": "/tmp", "mode": "rw"},
        {"kind": "tmpfs", "target": "/var/run/postgresql", "mode": "rw"}
      ],
      "environment_names": ["PGDATA", "POSTGRES_DB", "POSTGRES_HOST_AUTH_METHOD", "POSTGRES_USER", "TZ"]
    },
    {
      "id": "migration",
      "image": "sha256:1111111111111111111111111111111111111111111111111111111111111111",
      "user": "70:70",
      "read_only_root": true,
      "privileged": false,
      "no_new_privileges": true,
      "cap_drop": ["ALL"],
      "networks": ["data"],
      "published_ports": [],
      "mounts": [
        {"kind": "tmpfs", "target": "/tmp", "mode": "rw"}
      ],
      "environment_names": ["PGCONNECT_TIMEOUT", "TZ"]
    },
    {
      "id": "python-runner",
      "image": "sha256:2222222222222222222222222222222222222222222222222222222222222222",
      "user": "65532:65532",
      "read_only_root": true,
      "privileged": false,
      "no_new_privileges": true,
      "cap_drop": ["ALL"],
      "networks": ["data"],
      "published_ports": [],
      "mounts": [
        {"kind": "staged-input", "target": "/incidentseal/input", "mode": "ro"},
        {"kind": "staged-output", "target": "/incidentseal/output", "mode": "rw"},
        {"kind": "tmpfs", "target": "/tmp", "mode": "rw"}
      ],
      "environment_names": ["HOME", "INCIDENTSEAL_INPUT", "INCIDENTSEAL_OUTPUT", "PGDATABASE", "PGHOST", "PGPORT", "PGUSER", "PYTHONDONTWRITEBYTECODE", "PYTHONHASHSEED", "TZ"]
    },
    {
      "id": "node-runner",
      "image": "sha256:3333333333333333333333333333333333333333333333333333333333333333",
      "user": "65532:65532",
      "read_only_root": true,
      "privileged": false,
      "no_new_privileges": true,
      "cap_drop": ["ALL"],
      "networks": ["data"],
      "published_ports": [],
      "mounts": [
        {"kind": "staged-input", "target": "/incidentseal/input", "mode": "ro"},
        {"kind": "staged-output", "target": "/incidentseal/output", "mode": "rw"},
        {"kind": "tmpfs", "target": "/tmp", "mode": "rw"}
      ],
      "environment_names": ["HOME", "INCIDENTSEAL_INPUT", "INCIDENTSEAL_OUTPUT", "PGDATABASE", "PGHOST", "PGPORT", "PGUSER", "TZ"]
    }
  ],
  "networks": [
    {"id": "data", "driver": "bridge", "internal": true, "attachable": false, "external": false}
  ],
  "volumes": [
    {"id": "database-data", "driver": "local", "external": false}
  ]
}
